{
  "schema_version": "1.0",
  "record_id": "example-withings-001",
  "patient_id": "NL-CR-001",
  "device_type": "withings",
  "device_identifier": "WITHINGS-SIM-001",
  "source": {"type": "simulated", "name": "CareAI Device JSON Generator"},
  "measurement_timestamp": "2026-09-15T12:20:00Z",
  "measurements": {
    "systolic_bp": {"value": 128, "unit": "mmHg"},
    "diastolic_bp": {"value": 79, "unit": "mmHg"},
    "heart_rate": {"value": 70, "unit": "bpm"},
    "weight": {"value": 74.6, "unit": "kg"},
    "body_fat": {"value": 23.4, "unit": "%"}
  }
}
